{
  "버전": "1.0.0",
  "에타레벨정보": [
    { "LV": 0, "증댐": 2.0, "대미지상한": 3000000 },
    { "LV": 1, "증댐": 2.01, "대미지상한": 3160000 },
    { "LV": 2, "증댐": 2.01, "대미지상한": 3240000 },
    { "LV": 3, "증댐": 2.02, "대미지상한": 3320000 },
    { "LV": 4, "증댐": 2.02, "대미지상한": 3400000 },
    { "LV": 5, "증댐": 2.03, "대미지상한": 3500000 }
  ],
  "각성정보": [
    { "각성": 0, "대미지증가배율": 1.0 },
    { "각성": 1, "대미지증가배율": 1.0 },
    { "각성": 2, "대미지증가배율": 1.2 },
    { "각성": 3, "대미지증가배율": 1.4 },
    { "각성": 4, "대미지증가배율": 1.6 },
    { "각성": 5, "대미지증가배율": 2.0 }
  ],
  "몬스터정보": [
    {
      "이름": "투타토르",
      "스탯방어력": 990,
      "고정방어력": 0,
      "고정피해감소": 0,
      "피해감소율": 0,
      "속성수치": 90,
      "HP솔로": 380000000
    },
    {
      "이름": "머큐리얼 보스",
      "스탯방어력": 1500,
      "고정방어력": 7200,
      "고정피해감소": 0,
      "피해감소율": 48,
      "속성수치": 120,
      "HP솔로": 700000000
    },
    {
      "이름": "시오칸하임 오딘",
      "스탯방어력": 1500,
      "고정방어력": 51720,
      "고정피해감소": 4550,
      "피해감소율": 51,
      "속성수치": 125,
      "HP솔로": 8000000000
    }
  ]
}
